Name,Definition,Number
Page of Wands (Reversed),"-------------------------------------------------
PAGE OF WANDS (Reversed)

With the Page of Wands reversed, it tends to emphasize the more negative character traits of the upright version. He tends to show up when your mind is filled with one great idea after another, and are unable to progress beyond the beginning planning stages. Perhaps you have started a project or a hobby expecting that it would grow to great levels and instead you end up nowhere. As painful as it is, it is a good way of telling you that you should venture into other meaningful projects and avoid wasting time.
-------------------------------------------------",21
Knight of Wands (Upright),"-------------------------------------------------
KNIGHT OF WANDS (Upright)

The Knight of Wands' symbolism is straightforward. When it appears, it means a great time to get away and travel. The person should feel charged up and full of life. One is also ready to get things done. He is adventurous and can find fun things to do no matter where he is. There is never a dull moment when the Knight of Wands is around. When the Knight of Wands shows up in a reading it seems to suggest that the seeker wants to complete important tasks. One wants to impress others with one’s knowledge and skill. The card also shows up when the person is planning to move to another place of residence.

If you are starting a creative project, then you should do so with lots of energy and enthusiasm. However, you should balance it with realistic and well-rounded views. You should also have a plan that takes into account the consequences of your actions.

Getting the Knight of Wands in a reading can also mean that there is an event that you don’t expect to happen soon. If it is accompanied by the Eight of Wands, then you should expect a lot of changes in your life. More often than not, the Knight of Wands indicates a hasty change of job, residence, or anything in your life.
-------------------------------------------------",22
Knight of Wands (Reversed),"
-------------------------------------------------
KNIGHT OF WANDS (Reversed)

When you get a reversed Knight of Wands, it indicates frustrations and delays. You may feel angry and that you are not getting anywhere. A reversed Knight of Wands can translate to a loss of power. You may be trying to compensate for something that you don’t have total control over - this might lead to pessimism and loss of self-esteem.
-------------------------------------------------",23
Queen of Wands (Upright),"-------------------------------------------------
QUEEN OF WANDS (Upright)

In general, the Queen of wands in a reading meaning may depict a person of extreme focus and fiery passion. She is courageous and individualistic, though at times she may appear self-centered. They have a positive and an uplifting energy; they represent someone who is willing to be by your side and stand up for you. 

In terms of work, the Queen of wands signifies that you are planning to accomplish a significant amount of achievement in just a small amount of time. In the event that you are looking for a job, the appearance of this card may mean that a woman will play a major role in your career move. Generally speaking, in terms of your career, things are looking pretty good. The Queen of Wands in questions of love also sends a positive energy. For people who are searching for love, there is a possibility that you will find it soon.

When it comes to your finances, there is a chance that you are being carried away on spending a significant amount of money. We advise you to keep your expenses on check, or you will regret it in the end. In terms of health and spirituality, the Queen of Wands meaning may pertain to a spiritual hunger, a quest, or a search for meaning.
-------------------------------------------------",24
Queen of Wands (Reversed),"-------------------------------------------------
QUEEN OF WANDS (Reversed)

Regardless of its position (upright or reversed) the Queen of Wands symbolizes fertility, and all the feelings, emotions, and aspects that it brings. It may mean that there is someone who needs your help right now. In terms of work, there is a probability that you will encounter obstacles that will hamper your progress. Do not mind these obstacles and continue doing your job as you see fit. To see this card may also be a reminder to adhere to your rational side - to balance your sometimes chaotic energy with clear though, and you will be more successful.
-------------------------------------------------",25
King of Wands (Upright),"-------------------------------------------------
KING OF WANDS (Upright)

The meaning of the upright position of the King of Wands represents pure energy. Unlike the other wands cards in the deck however, this particular one is not focused on pure creativity. Instead, this king is actually way more likely to take an idea and to decisively implement it himself. The King of Wands is a natural born leader of people, and he is also extremely capable. Once the king sets for himself a certain aim or a goal, he is going to conveniently stick to it in order to ensure that it becomes a reality.

The King of Wands looks forward to all sorts of different challenges - whether great or small, for he gets a natural adrenaline rush associated with the solving of problems.
-------------------------------------------------",26
King of Wands (Reversed),"-------------------------------------------------
KING OF WANDS (Reversed)

The negative aspect of the card is associated, as you may guess, with a feeling of arrogance. He can even be rather aggressive in the actual pursuit of his goals, regardless of whether he’s actually conscious or not of it. He wouldn’t show restraint, nor even the humbleness to know when his assistance isn’t actually required.

When reversed, the card depicts a personality which is prone to taking rash, impulsive and hasty decisions. This person could be pushy, overbearing as well as dominating at times. Even though he might rarely do this with a sense of malice or with an intention to make someone feel submissive, this is without a doubt a part of his character that one can be frustrated at.

In reversal, the card represents the worst spectrum of the qualities of the fire – selfishness and ruthlessness. He can be manipulative as long as you are serving his purpose. With this in mind, the card definitely points out strong and weak aspects, and reflecting on his image can help you dig deeper in your personality. 
-------------------------------------------------",27
